{
  "id":"viking-02-everyday-life","kind":"question_page","title":{"ja":"ヴァイキングは普段、何をしていた？","ru":"Как викинги жили каждый день?"},
  "question":{"ja":"戦っていない時、人々はどう暮らしていたの？","ru":"Чем люди занимались, когда не воевали?"},
  "answer":{"ja":"結論からいうと、日常の中心は農業・牧畜・漁業・手工業でした。遠征は社会の一部であって、生活のすべてではありません。","ru":"Коротко: основу повседневной жизни составляли земледелие, скотоводство, рыболовство и ремёсла. Походы были лишь частью жизни общества."},
  "story":{"ja":["北欧の多くの家では、穀物を育て、家畜を飼い、魚をとり、冬に備えて食料を保存しました。木工、鍛冶、織物づくりも重要でした。","農場は家族だけの小さな単位とは限りません。親族や従属する人々、奴隷を含むこともあり、家そのものが生産と権力の場でした。","一方、リーベやヘーゼビューのような交易拠点では職人と商人が集まりました。農村で作られたものが港へ運ばれ、遠くの銀やガラス、装身具と交換されます。"],"ru":["Во многих хозяйствах выращивали зерно, держали скот, ловили рыбу и заготавливали пищу на зиму. Важны были деревообработка, кузнечное дело и ткачество.","Ферма могла включать не только семью, но и зависимых людей и рабов. Дом был одновременно местом производства и власти.","В торговых центрах вроде Рибе и Хедебю встречались ремесленники и купцы. Продукты сельской жизни связывались с дальними рынками серебра, стекла и украшений."]},
  "evidence":{"ja":["住居跡や家畜骨、穀物、道具、織物用具から日常生活が分かります。","港湾遺跡の出土品は、農村と遠距離交易がつながっていたことを示します。"],"ru":["Жилища, кости животных, зерно, инструменты и ткацкие принадлежности показывают устройство быта.","Находки из портов демонстрируют связь сельских хозяйств с дальними рынками."]},
  "so_what":{"ja":"『ヴァイキング＝戦士』というイメージを外すと、なぜ交易や移住がこれほど広がったのかを社会全体から考えられます。","ru":"Если отказаться от образа «викинг = воин», становится понятнее, почему торговля и переселение были настолько важны."},
  "period":{"start":750,"end":1100,"label":{"ja":"8〜11世紀","ru":"VIII–XI века"}},"places":["scandinavia","hedby"],"domains":["daily-life","economy","culture"],"entities":["scandinavia","hedby"],"topics":["viking-age"],"concepts":["agrarian-life","household","trade-center"],
  "timeline":{"layer":"people","importance":4},"image":{"query":"Viking Age farm Hedeby reconstruction","preferred_sources":["Wikimedia Commons","National Museum of Denmark"]},
  "layers":[{"type":"detail","title":{"ja":"港町はなぜ重要？","ru":"Почему торговые центры были важны?"},"body":{"ja":"交易拠点は、物が集まる場所であると同時に、権力者が安全を保証し税を得る場所でもありました。","ru":"Торговые центры были не только рынками, но и местами, где правители обеспечивали безопасность и получали пошлины."}},{"type":"connect","title":{"ja":"農村と世界経済はつながっていた","ru":"Сельская жизнь была частью мировой торговли"},"body":{"ja":"毛皮、鉄、木材、家畜など地域の生産物が、銀やガラスなど遠方の品と交換されました。","ru":"Меха, железо, древесина и скот обменивались на серебро, стекло и другие дальние товары."}}],
  "sources":["natmus-viking-people"],"relations":[{"type":"reaction_to","target":"viking-01-who"},{"type":"leads_to","target":"viking-03-why-sea"}],"next":"viking-03-why-sea"
}