{
  "id":"viking-08-religion","kind":"question_page","title":{"ja":"北欧神話は、人々にとって何だった？","ru":"Что значили северные мифы для людей?"},
  "question":{"ja":"オーディンやトールの物語は、日常生活とどう関係していた？","ru":"Как истории об Одине и Торе были связаны с повседневной жизнью?"},
  "answer":{"ja":"結論からいうと、神話は娯楽だけではなく、豊作、航海、戦い、結婚、死者の扱いなど日常の儀礼や世界観と結びついていました。ただし、全北欧で一つの統一教典があったわけではありません。","ru":"Коротко: мифы были связаны не только с рассказами, но и с урожаем, путешествиями, войной, браком, смертью и ритуалами. При этом единой священной книги для всей Скандинавии не существовало."},
  "story":{"ja":["現代ではオーディンやトールが有名ですが、当時の信仰は『神話を暗記すること』ではありませんでした。共同体の祭祀や誓い、葬送、季節の行事などと結びついていました。","しかも、私たちが知る北欧神話のまとまった物語の多くは、ヴァイキング時代より後に書き留められています。だから、後世の物語をそのまま8〜10世紀の全員の信仰だと思うことはできません。","9〜10世紀にはキリスト教との接触が増えます。古い信仰が一夜で消えたのではなく、しばらく並存し、政治や交易とも結びつきながら社会が変わりました。"],"ru":["Сегодня наиболее известны Один и Тор, но вера эпохи викингов не сводилась к знанию мифов. Она была связана с ритуалами общины, клятвами, похоронами и сезонными практиками.","Многие цельные рассказы о северных богах были записаны уже после эпохи викингов. Поэтому поздние тексты нельзя автоматически считать точным описанием веры всех людей VIII–X веков.","В IX–X веках контакты с христианством усиливались. Старые верования не исчезли за один день: некоторое время системы сосуществовали, а изменения были связаны и с политикой, и с торговлей."]},
  "evidence":{"ja":["ルーン碑文、墓、装身具、祭祀遺構などを後世の文献と組み合わせて研究します。","デンマークでは十字架とトールの槌を同じ鋳型で作れる資料が、信仰の並存を考える手がかりになります。"],"ru":["Исследователи сопоставляют рунические надписи, могилы, украшения и ритуальные объекты с более поздними текстами.","В Дании известна литейная форма, позволявшая делать и крест, и молот Тора — важная подсказка к сосуществованию верований."]},
  "so_what":{"ja":"『宗教が変わった』を思想だけでなく、交易・外交・王権の変化と一緒に見ると、社会変化として理解できます。","ru":"Религиозные изменения становятся понятнее, если смотреть на них вместе с торговлей, дипломатией и укреплением королевской власти."},
  "period":{"start":800,"end":1050,"label":{"ja":"9〜11世紀","ru":"IX–XI века"}},"places":["scandinavia","denmark"],"domains":["religion","culture","politics"],"entities":["harald-bluetooth","scandinavia"],"topics":["viking-age","religion-in-europe"],"concepts":["ritual-religion","source-distance","gradual-conversion"],
  "timeline":{"layer":"ideas","importance":5},"image":{"query":"Viking Thor hammer cross mould Denmark","preferred_sources":["National Museum of Denmark","Wikimedia Commons"]},
  "layers":[{"type":"source","title":{"ja":"エッダは『ヴァイキングの聖書』ではない","ru":"Эдды — не «Библия викингов»"},"body":{"ja":"『詩のエッダ』『散文のエッダ』は重要ですが、記録された時期と社会背景を考慮して読む必要があります。","ru":"Поэтическая и прозаическая Эдды важны, но их необходимо читать с учётом времени записи и христианского контекста."}},{"type":"debate","title":{"ja":"『北欧宗教』は一つだった？","ru":"Была ли одна северная религия?"},"body":{"ja":"地域や時期によって神々の重要性や儀礼が異なった可能性があります。『統一された体系』を先に想定しないことが重要です。","ru":"Значение богов и обрядов могло различаться по регионам и времени. Не следует заранее предполагать единую неизменную систему."}}],
  "sources":["natmus-christianity"],"relations":[{"type":"influences","target":"viking-11-state-formation"},{"type":"leads_to","target":"viking-09-women-slavery"}],"next":"viking-09-women-slavery"
}