{
  "id":"viking-04-longships","kind":"question_page","title":{"ja":"ヴァイキングの船は、何がそんなにすごかった？","ru":"Почему корабли викингов были настолько эффективны?"},
  "question":{"ja":"海だけでなく川の奥まで進めたのはなぜ？","ru":"Почему они могли ходить и по морю, и далеко вверх по рекам?"},
  "answer":{"ja":"結論からいうと、浅い喫水、軽い船体、帆と櫂の併用が強みでした。外洋を渡りながら浅い川にも入り、必要なら船を陸に引き上げやすい設計が、行動範囲を大きく広げました。","ru":"Коротко: их сила была в малой осадке, лёгком корпусе и сочетании паруса с вёслами. Такие суда могли пересекать море, входить в мелкие реки и сравнительно легко вытаскиваться на берег."},
  "story":{"ja":["ヴァイキングの船は一種類ではありません。交易に向く幅広い船もあれば、速さと機動性を重視した軍船もありました。","重要なのは、海岸で終わらなかったことです。浅い川へ入り、港のない場所でも上陸しやすい。敵にとっては『どこから来るか分かりにくい』移動手段でした。","でも船だけで歴史が動いたわけではありません。船を造る木材、鉄、帆布、技術者、乗組員、食料を用意できる社会の仕組みがあって初めて、遠距離移動が続けられました。"],"ru":["Корабли викингов не были одним типом судна. Были широкие торговые корабли и более узкие военные суда, рассчитанные на скорость и манёвренность.","Главное преимущество заключалось в том, что путешествие не заканчивалось на морском берегу. Малая осадка позволяла входить в реки и высаживаться там, где не было порта.","Но технология сама по себе не объясняет успех. Нужны были древесина, железо, паруса, мастера, экипаж и снабжение — то есть общество, способное поддерживать такие плавания."]},
  "evidence":{"ja":["ロスキレのヴァイキング船博物館で保存されるスクルデレウ船群から、用途の異なる船の設計が分かります。","スクルデレウ5号は全長約17.3m、喫水約0.6m、26本の櫂を備えた小型軍船でした。"],"ru":["Корабли из Скулделева в музее Роскилле показывают разные конструкции для разных задач.","Скулделев 5 — небольшой военный корабль длиной около 17,3 м, с осадкой около 0,6 м и 26 вёслами."]},
  "so_what":{"ja":"『優れた発明が歴史を変えた』ではなく、『技術がどんな行動を可能にし、社会がそれをどう使ったか』を見ることが重要です。","ru":"Важно спрашивать не только, насколько хороша была технология, но и какие действия она делала возможными и как общество ею пользовалось."},
  "period":{"start":750,"end":1050,"label":{"ja":"8〜11世紀","ru":"VIII–XI века"}},"places":["scandinavia","north-sea","rivers"],"domains":["technology","military","economy"],"entities":["longship","vikings"],"topics":["viking-age","maritime-history"],"concepts":["shallow-draft","mobility-technology","technology-and-society"],
  "timeline":{"layer":"technology","importance":5},"image":{"query":"Skuldelev 5 Viking ship Roskilde","preferred_sources":["Viking Ship Museum Roskilde","Wikimedia Commons"]},
  "layers":[{"type":"detail","title":{"ja":"ロングシップは全部同じ？","ru":"Все длинные корабли были одинаковыми?"},"body":{"ja":"いいえ。軍事、交易、沿岸航行など目的に応じて寸法や形が異なりました。『ヴァイキング船』を一種類の万能船と考えない方が正確です。","ru":"Нет. Размеры и форма различались в зависимости от военных, торговых и прибрежных задач."}},{"type":"source","title":{"ja":"実物の船から何が分かる？","ru":"Что показывают реальные корабли?"},"body":{"ja":"船体寸法、補修跡、木材、櫂の数などから、速度だけでなく運用方法や必要な人員まで推測できます。","ru":"Размеры корпуса, следы ремонта, древесина и количество вёсел позволяют судить не только о скорости, но и об эксплуатации и экипаже."}}],
  "sources":["vikingmuseum-skuldelev5"],"relations":[{"type":"contributes_to","target":"viking-05-raids-and-trade"},{"type":"compare_with","target":"age-of-exploration-navigation"}],"next":"viking-05-raids-and-trade"
}