{
  "id":"viking-09-women-slavery","kind":"question_page","title":{"ja":"女性や奴隷は、ヴァイキング社会でどう生きた？","ru":"Как жили женщины и рабы в обществе викингов?"},
  "question":{"ja":"戦士以外の人々を見ると、社会はどう違って見える？","ru":"Как меняется картина общества, если смотреть не только на воинов?"},
  "answer":{"ja":"結論からいうと、ヴァイキング社会には性別・身分・自由身分か奴隷かによる大きな差がありました。女性は家政・生産・相続や農場運営に重要な役割を持つ一方、奴隷制も社会と交易の一部でした。","ru":"Коротко: общество эпохи викингов было сильно неравным по полу, статусу и свободе. Женщины играли важную роль в хозяйстве, производстве и иногда наследовании, а рабство было частью общества и торговли."},
  "story":{"ja":["英雄物語だけを読むと、社会が自由な戦士の集団に見えてしまいます。でも実際の農場や家では、食料生産、織物、家畜管理、財産管理など多くの仕事がありました。","女性の法的権利や役割は地域・身分によって異なります。家を切り盛りしたり、夫の不在時に農場を管理したり、財産を相続した例もありますが、現代的な男女平等と同じではありません。","そして見落としやすいのが奴隷です。戦争や交易で人が奴隷として移動し、労働力や財産として扱われました。ヴァイキング時代の広域ネットワークは、物だけでなく人間も運びました。"],"ru":["Если читать только героические рассказы, общество кажется миром свободных воинов. Но на фермах существовал огромный объём труда: производство пищи, ткани, уход за скотом и управление хозяйством.","Права и роли женщин различались по региону и статусу. Они могли управлять хозяйством, особенно в отсутствие мужа, и в некоторых случаях наследовать имущество, но это не было современным равенством.","Важно не забывать о рабстве. Людей захватывали и продавали, использовали как рабочую силу и имущество. Дальние сети эпохи викингов перемещали не только товары, но и людей."]},
  "evidence":{"ja":["墓、副葬品、住居、道具、法文書や後世の記録から性別・身分ごとの生活を復元します。","奴隷交易は北欧と東西の交易網の両方に関係していました。"],"ru":["Могилы, инвентарь, жилища, инструменты и правовые тексты помогают восстановить жизнь людей разных статусов.","Торговля рабами была связана и с западными, и с восточными сетями обмена."]},
  "so_what":{"ja":"『誰が歴史を動かしたか』を見る時、王や戦士だけでなく、社会を維持した労働と不平等も含める必要があります。","ru":"Историю общества нельзя понять только через королей и воинов: нужно видеть труд, который поддерживал общество, и существовавшее неравенство."},
  "period":{"start":750,"end":1100,"label":{"ja":"8〜11世紀","ru":"VIII–XI века"}},"places":["scandinavia","britain","eastern-europe"],"domains":["daily-life","economy","law","culture"],"entities":["vikings"],"topics":["viking-age","social-history"],"concepts":["household-labor","status-inequality","slavery-network"],
  "timeline":{"layer":"people","importance":4},"image":{"query":"Viking Age textile tools grave goods woman archaeology","preferred_sources":["Wikimedia Commons","National Museum of Denmark"]},
  "layers":[{"type":"detail","title":{"ja":"『女性戦士』はどこまで分かる？","ru":"Что известно о женщинах-воинах?"},"body":{"ja":"武器を伴う女性墓などは重要ですが、墓の性別・役割・象徴性の解釈は慎重さが必要です。個別の資料から社会全体を単純化しないことが大切です。","ru":"Женские погребения с оружием важны, но интерпретация пола, роли и символики захоронения требует осторожности. Отдельная находка не описывает всё общество."}},{"type":"connect","title":{"ja":"奴隷交易はどこへつながる？","ru":"Куда вела торговля рабами?"},"body":{"ja":"北欧の奴隷交易は西ヨーロッパだけでなく東方交易とも結びつきました。交易ネットワークの『繁栄』には人身売買という暴力も含まれていました。","ru":"Торговля рабами была частью как западных, так и восточных сетей. Экономический рост этой эпохи включал и насильственное перемещение людей."}}],
  "sources":["natmus-viking-people","natmus-viking-age"],"relations":[{"type":"same_time_as","target":"viking-08-religion"},{"type":"leads_to","target":"viking-10-england"}],"next":"viking-10-england"
}