{
  "id":"viking-11-state-formation","kind":"question_page","title":{"ja":"ヴァイキング時代は、なぜ国家形成につながった？","ru":"Как эпоха викингов связана с формированием государств?"},
  "question":{"ja":"遠征や交易が、王権や税や宗教の仕組みとどう結びついた？","ru":"Как походы и торговля были связаны с королевской властью, налогами и религией?"},
  "answer":{"ja":"結論からいうと、遠征そのものが国家を作ったのではありません。軍事動員、交易拠点の支配、徴税、キリスト教化、王家同士の競争が重なり、より広い地域を継続的に統治する仕組みが強まりました。","ru":"Коротко: сами походы не «создали государства». Но военная мобилизация, контроль торговли, налоги, христианизация и конкуренция династий вместе усиливали способность правителей управлять большими территориями."},
  "story":{"ja":["遠征には船、人、食料、武器が必要です。大規模な活動を続けるには、一時的な戦士集団だけではなく資源を集める仕組みが必要になります。","交易拠点を守る王は、同時に通行や市場から利益を得られます。軍事と交易は、王権が資源を集める手段にもなりました。","さらにキリスト教化は外交や王の正統性と結びつきました。デンマークのハーラル青歯王のイェリング石碑は、宗教の転換と王権の自己表現が重なる象徴的な資料です。"],"ru":["Походы требовали кораблей, людей, пищи и оружия. Для длительной крупной мобилизации нужны были механизмы сбора ресурсов, а не только временные отряды воинов.","Правитель, защищавший торговый центр, мог одновременно получать пошлины и контролировать движение богатства. Война и торговля становились источниками власти.","Христианизация была связана с дипломатией и легитимностью правителей. Еллингский камень Харальда Синезубого символически соединяет религиозное изменение и королевскую власть."]},
  "evidence":{"ja":["イェリング石碑や交易都市、要塞、貨幣などから王権の広がりを追えます。","イングランドでも対ヴァイキング戦争と徴税・軍事制度の発達が関連して研究されています。"],"ru":["Еллингские камни, торговые центры, укрепления и монеты помогают проследить усиление королевской власти.","В Англии войны с викингами изучаются вместе с развитием налоговой и военной организации."]},
  "so_what":{"ja":"国家形成を『偉大な王が国を作った』物語ではなく、戦争・税・宗教・市場を維持する能力の成長として見られます。","ru":"Формирование государства можно понимать не как историю одного великого короля, а как рост способности поддерживать войну, налоги, религию и рынки."},
  "period":{"start":900,"end":1050,"label":{"ja":"10〜11世紀","ru":"X–XI века"}},"places":["scandinavia","denmark","england"],"domains":["politics","military","economy","religion"],"entities":["harald-bluetooth","cnut"],"topics":["viking-age","state-formation"],"concepts":["resource-mobilization","royal-legitimacy","state-capacity"],
  "timeline":{"layer":"politics","importance":5},"image":{"query":"Jelling stone Harald Bluetooth Denmark","preferred_sources":["National Museum of Denmark","Wikimedia Commons"]},
  "layers":[{"type":"connect","title":{"ja":"敵への支払いも国家能力？","ru":"Платить врагу — тоже признак государства?"},"body":{"ja":"イングランドのデーンゲルドのような大規模支払いは弱さの証拠である一方、全国から大量の銀を集める行政能力の存在も示します。","ru":"Крупные выплаты вроде данегельда показывают давление врага, но одновременно и способность власти собрать огромные ресурсы по всей стране."}},{"type":"debate","title":{"ja":"『ヴァイキングが国家を作った』と言える？","ru":"Можно ли сказать, что викинги создали государства?"},"body":{"ja":"戦争は重要な刺激でしたが、王家、教会、土地制度、地域共同体など他の要因も必要です。結果を知っている私たちが、すべてを国家成立への一本道として読むことには注意が必要です。","ru":"Война была важным стимулом, но нужны были и династии, церковь, земельные отношения и местные общества. Нельзя читать прошлое как прямую дорогу к уже известному государству."}}],
  "sources":["natmus-christianity","oxford-danegeld","englishheritage-vikings-england"],"relations":[{"type":"reaction_to","target":"viking-10-england"},{"type":"leads_to","target":"viking-12-legacy"}],"next":"viking-12-legacy"
}