{
  "id":"viking-03-why-sea","kind":"question_page","title":{"ja":"なぜ北欧の人々は海へ出た？","ru":"Почему жители Скандинавии вышли в море?"},
  "question":{"ja":"8世紀末から海外活動が急に目立つようになったのはなぜ？","ru":"Почему с конца VIII века морская активность стала такой заметной?"},
  "answer":{"ja":"結論からいうと、理由は一つではありません。船の技術、交易の利益、富と地位をめぐる競争、周辺地域の政治状況などが重なって、海へ出ることが魅力的で現実的になりました。","ru":"Коротко: одной причины не было. Корабельные технологии, выгоды торговли, борьба за богатство и статус и политическая ситуация соседей вместе сделали морские походы привлекательными и возможными."},
  "story":{"ja":["よくある説明は『北欧が貧しかったから』です。でも、それだけではなぜ特定の時期に活動が急増したのか説明しきれません。","北欧にはすでに交易網があり、船を操る技術も蓄積されていました。遠くへ行けば銀や高価な品、土地、名声を得る機会がありました。","同時に、西ヨーロッパ側には海岸沿いに富の集まる修道院や都市があり、地域によっては政治的な分裂もありました。『行ける技術』と『行く動機』と『行き先の条件』が重なったのです。"],"ru":["Иногда говорят, что скандинавы вышли в море просто из-за бедности. Но это не объясняет, почему активность резко выросла именно в определённый период.","Торговые сети существовали уже раньше, а морские навыки накапливались постепенно. Дальние поездки давали шанс получить серебро, товары, землю и престиж.","Одновременно на побережьях Западной Европы находились богатые монастыри и города, а некоторые регионы были политически раздроблены. Возможность, мотивация и условия на стороне соседей совпали."]},
  "evidence":{"ja":["考古学と史料は、略奪以前から北海・バルト海交易が存在したことを示します。","ヴァイキング時代開始の原因については研究上も単一説明ではなく複数要因が検討されています。"],"ru":["Археология и источники показывают существование торговли в Северном и Балтийском морях ещё до знаменитых набегов.","Современные исследования рассматривают начало эпохи викингов как результат нескольких факторов, а не одной причины."]},
  "so_what":{"ja":"歴史を『貧困→侵略』の一本線で説明せず、技術・経済・政治・社会的欲求の組み合わせで見る練習になります。","ru":"Этот пример учит видеть историю не как простую цепочку «бедность → вторжение», а как взаимодействие технологий, экономики, политики и социальных стимулов."},
  "period":{"start":760,"end":850,"label":{"ja":"8〜9世紀","ru":"VIII–IX века"}},"places":["scandinavia","britain","north-sea"],"domains":["economy","technology","politics","military"],"entities":["vikings","longship"],"topics":["viking-age"],"concepts":["multi-causal-history","mobility-incentives","trade-and-raiding"],
  "timeline":{"layer":"economy","importance":5},"image":{"query":"Viking ship North Sea historical reconstruction","preferred_sources":["Wikimedia Commons","Viking Ship Museum Roskilde"]},
  "layers":[{"type":"detail","title":{"ja":"人口増加だけで説明できる？","ru":"Можно ли всё объяснить ростом населения?"},"body":{"ja":"人口圧力は候補の一つですが、地域差が大きく、活動の時期や方向をそれだけで説明するのは難しいと考えられます。","ru":"Демографическое давление рассматривается как один из факторов, но региональные различия не позволяют объяснить им всё."}},{"type":"debate","title":{"ja":"研究者は原因をどう争っている？","ru":"О чём спорят исследователи?"},"body":{"ja":"富・婚姻・地位競争、政治変化、交易機会など、どの要因を重く見るかで議論があります。重要なのは一つの原因に還元しないことです。","ru":"Исследователи по-разному оценивают роль богатства, брачных стратегий, статуса, политических изменений и торговли. Важно не сводить всё к одному фактору."}}],
  "sources":["antiquity-viking-causes","natmus-viking-age"],"relations":[{"type":"contributes_to","target":"viking-05-raids-and-trade"},{"type":"leads_to","target":"viking-04-longships"}],"next":"viking-04-longships"
}