{
  "id":"viking-06-eastward","kind":"question_page","title":{"ja":"ヴァイキングは東へどこまで行った？","ru":"Как далеко викинги уходили на восток?"},
  "question":{"ja":"北欧からロシアやビザンツ、イスラーム世界まで本当につながっていた？","ru":"Правда ли, что Скандинавия была связана с Русью, Византией и исламским миром?"},
  "answer":{"ja":"結論からいうと、つながっていました。バルト海から東ヨーロッパの河川を通り、黒海・カスピ海方面へ進む交易路があり、北欧には大量のイスラーム銀貨が流入しました。","ru":"Коротко: да. Через Балтику и реки Восточной Европы существовали пути к Чёрному и Каспийскому морям, а в Скандинавию поступало большое количество исламского серебра."},
  "story":{"ja":["ヴァイキングというと西のイングランドやフランスを思い浮かべがちですが、東への動きも非常に重要でした。","船は河川を利用し、現在のロシア・ウクライナ・ベラルーシ周辺を通って黒海やカスピ海方向へ向かいました。場所によっては船を陸路で運ぶ必要もありました。","その交易を物語る分かりやすい証拠が銀です。イスラーム世界で鋳造されたディルハム銀貨が北欧で大量に発見され、遠く離れた地域が一つの交換圏でつながっていたことが分かります。"],"ru":["При слове «викинги» часто вспоминают Англию и Францию, но восточное направление было не менее важным.","По рекам Восточной Европы путешественники двигались через территории нынешних России, Украины и Беларуси к Чёрному и Каспийскому морям. Иногда суда приходилось перетаскивать по суше.","Особенно наглядное свидетельство — серебро. В Скандинавии найдено много дирхамов, чеканенных в исламском мире, что показывает огромную протяжённость обменных сетей."]},
  "evidence":{"ja":["北欧の銀貨埋蔵からイスラーム世界のディルハムが多数発見されています。","河川沿いの交易拠点や墓、貨幣、装身具が東西交流を示します。"],"ru":["В скандинавских кладах найдено множество дирхамов исламского мира.","Поселения, могилы, монеты и украшения вдоль речных путей показывают связи между востоком и севером Европы."]},
  "so_what":{"ja":"『ヨーロッパ史』と『イスラーム史』を別々に見るより、銀や人の移動を追うと中世初期の世界がすでに広域ネットワークだったことが分かります。","ru":"Если следить за движением серебра и людей, раннесредневековая Европа и исламский мир выглядят не изолированными, а связанными сетьями."},
  "period":{"start":800,"end":1000,"label":{"ja":"9〜10世紀","ru":"IX–X века"}},"places":["baltic","eastern-europe","black-sea","caspian"],"domains":["economy","technology","politics"],"entities":["vikings","islamic-silver","constantinople"],"topics":["viking-age","eurasian-trade"],"concepts":["river-routes","silver-flow","eurasian-network"],
  "timeline":{"layer":"economy","importance":5},"image":{"query":"Viking Islamic dirham silver hoard Scandinavia","preferred_sources":["Wikimedia Commons","National Museum of Denmark"]},
  "layers":[{"type":"detail","title":{"ja":"銀貨はそのままお金として使った？","ru":"Монеты использовали по номиналу?"},"body":{"ja":"北欧では銀を額面ではなく重さで評価し、貨幣や銀製品を切り分けて使う場面もありました。貨幣経済と重量銀の慣行が重なります。","ru":"В Скандинавии серебро часто оценивали по весу; монеты и украшения могли разрезать. Денежное обращение сосуществовало с весовым серебром."}},{"type":"connect","title":{"ja":"後のルーシ史にもつながる","ru":"Связь с историей Руси"},"body":{"ja":"北欧系の移動者は東ヨーロッパの政治・交易拠点にも関わりました。ただし『国家を外から作った』という単純な説明ではなく、地域社会との混合や複数勢力の関係を見る必要があります。","ru":"Скандинавские группы участвовали в торговле и политике Восточной Европы, но простая формула «они создали государство извне» скрывает роль местных обществ и смешение групп."}}],
  "sources":["natmus-viking-age"],"relations":[{"type":"influences","target":"rus-formation"},{"type":"compare_with","target":"silk-road"},{"type":"leads_to","target":"viking-07-north-atlantic"}],"next":"viking-07-north-atlantic"
}