{
  "id":"viking-10-england","kind":"question_page","title":{"ja":"ヴァイキングはイングランドで何を変えた？","ru":"Что викинги изменили в Англии?"},
  "question":{"ja":"襲撃が、どうして定住や政治の変化につながった？","ru":"Как набеги превратились в поселение и политические изменения?"},
  "answer":{"ja":"結論からいうと、襲撃はやがて大規模な軍事行動と定住へ変わり、イングランド北部・東部ではスカンディナヴィア系の支配や法が強い地域が生まれました。同時に、対抗する側の王権や軍事・課税制度も変化しました。","ru":"Коротко: набеги постепенно переросли в крупные военные кампании и поселение. На севере и востоке Англии возникли районы сильного скандинавского влияния, а сопротивление этим силам изменило королевскую власть, военную организацию и налоги."},
  "story":{"ja":["最初の襲撃は短期的でしたが、9世紀後半になると『大異教軍』と呼ばれる軍勢がイングランドで長期行動を始めます。","戦いの後、一部の地域ではスカンディナヴィア系の人々が土地を得て定住しました。後世に『デーンロウ』と呼ばれる地域では、地名や貨幣、法、政治文化にその影響が残ります。","一方、ウェセックス側も変わりました。防御拠点、軍事動員、税の仕組みなどが整えられ、外からの圧力が国内の制度形成を促す一因になりました。"],"ru":["Первые нападения были краткими, но во второй половине IX века так называемая Великая языческая армия начала длительные кампании в Англии.","После войн часть скандинавов получила землю и поселилась. В районах, позднее называемых Данелагом, влияние сохранилось в топонимах, монетах, праве и политической культуре.","Изменился и Уэссекс. Усиливались оборонительные центры, военная мобилизация и система сборов. Внешнее давление стало одним из факторов институциональных изменений."]},
  "evidence":{"ja":["英語地名に残る古ノルド語由来要素や、ヨークなどの貨幣が定住と支配の痕跡を示します。","年代記と考古資料を組み合わせることで、襲撃から定住への変化を追えます。"],"ru":["Древнескандинавские элементы в английских топонимах и монеты из Йорка показывают следы поселения и власти.","Сопоставление хроник и археологии позволяет проследить переход от набегов к постоянному присутствию."]},
  "so_what":{"ja":"『侵略した側』だけでなく、『侵略された側の制度がどう変わるか』を見ると、戦争が国家形成に与える影響を考えられます。","ru":"Если смотреть не только на захватчиков, но и на изменения в обществе, которое сопротивлялось, видно, как войны могут влиять на формирование институтов."},
  "period":{"start":865,"end":1016,"label":{"ja":"9〜11世紀初頭","ru":"IX–начало XI века"}},"places":["england","danelaw","york"],"domains":["politics","military","law","economy"],"entities":["heathen-army","danelaw","york","cnut"],"topics":["viking-age","medieval-england"],"concepts":["settlement-after-conquest","danelaw","institutional-response"],
  "timeline":{"layer":"politics","importance":5},"image":{"query":"Viking Danelaw York coin map","preferred_sources":["British Museum","Ashmolean Museum","Wikimedia Commons"]},
  "layers":[{"type":"detail","title":{"ja":"デーンロウは国名ではない","ru":"Данелаг — не название одного государства"},"body":{"ja":"スカンディナヴィア系の支配や法、定住が強かった地域を後世にまとめて呼ぶ言葉で、単一の中央集権国家を意味しません。","ru":"Это историческое название районов сильного скандинавского влияния, а не единого централизованного государства."}},{"type":"source","title":{"ja":"地名と貨幣は何を教える？","ru":"Что показывают топонимы и монеты?"},"body":{"ja":"地名は定住の長期的な痕跡、貨幣は支配者・造幣・交易圏を示します。文字史料と違う種類の証拠を組み合わせられます。","ru":"Топонимы показывают долговременное поселение, а монеты — власть, чеканку и экономические связи. Они дополняют письменные источники."}}],
  "sources":["englishheritage-vikings-england","ashmolean-danelaw","britishmuseum-angloviking-coin"],"relations":[{"type":"leads_to","target":"viking-11-state-formation"},{"type":"influences","target":"england-unification"}],"next":"viking-11-state-formation"
}