{
  "id":"viking-01-who","kind":"question_page","title":{"ja":"ヴァイキングって、そもそも何者？","ru":"Кто вообще такие викинги?"},
  "question":{"ja":"ヴァイキングは民族だったの？ 海賊だったの？","ru":"Викинги — это народ или морские разбойники?"},
  "answer":{"ja":"結論からいうと、ヴァイキングは『海賊の民族』ではありません。8〜11世紀の北欧社会の中で、船で交易・略奪・移住・軍事活動に出た人々を指す言葉として考える方が実態に近いです。","ru":"Коротко: викинги — не отдельный «народ пиратов». Так удобнее называть людей из скандинавского общества VIII–XI веков, которые отправлялись морем торговать, грабить, переселяться и воевать."},
  "story":{"ja":["1200年ほど前、現在のデンマーク、ノルウェー、スウェーデン周辺には、農業や漁業、手工業で暮らす人々がいました。全員が戦士だったわけではありません。","その社会の一部の人々が、船で北海やバルト海へ出ていきます。ある時は商人、ある時は略奪者、また別の時には移住者や傭兵でした。","だから『ヴァイキング』を一つの性格を持つ民族として見ると、実際の社会の幅が見えにくくなります。まずは“北欧の人々が海を使って外の世界と急速につながった時代”と捉えると分かりやすくなります。"],"ru":["Около 1200 лет назад жители нынешних Дании, Норвегии и Швеции в основном занимались земледелием, рыболовством и ремёслами. Не все были воинами.","Часть людей выходила в Северное и Балтийское моря. В одной ситуации они были торговцами, в другой — грабителями, переселенцами или наёмниками.","Поэтому полезнее понимать эпоху викингов как время, когда скандинавское общество резко расширило связи с внешним миром через море."]},
  "evidence":{"ja":["博物館資料では、ヴァイキング時代の人々の大多数が農業を基盤に暮らしていたことが示されます。","文字史料だけでなく、農場、墓、港、貨幣、船、装身具などの考古資料から社会全体を復元します。"],"ru":["Музейные данные показывают, что большинство людей эпохи викингов жило прежде всего сельским хозяйством.","Картину общества восстанавливают по фермам, могилам, портам, монетам, кораблям и украшениям, а не только по хроникам."]},
  "so_what":{"ja":"この定義を最初に押さえると、後の『なぜ海へ出た？』『本当に略奪だけ？』が全部つながって理解できます。","ru":"Эта рамка помогает дальше понять, почему люди выходили в море и почему набеги были лишь частью более широкой истории."},
  "period":{"start":750,"end":1100,"label":{"ja":"8〜11世紀","ru":"VIII–XI века"}},"places":["scandinavia","britain","baltic"],"domains":["daily-life","economy","military","culture"],"entities":["vikings","scandinavia"],"topics":["viking-age"],"concepts":["viking-definition","scandinavian-society","mobility"],
  "timeline":{"layer":"people","importance":5},"image":{"query":"Viking Age Scandinavian farm ship archaeology","preferred_sources":["Wikimedia Commons","National Museum of Denmark"]},
  "layers":[{"type":"detail","title":{"ja":"『ヴァイキング』は職業名？","ru":"«Викинг» — это профессия?"},"body":{"ja":"語の使われ方は時代と史料で異なるため、現代の『民族名』のように固定して扱わない方が安全です。","ru":"Значение слова менялось в зависимости от времени и источника, поэтому его не стоит использовать как современное этническое название."}},{"type":"source","title":{"ja":"何から分かる？","ru":"Откуда мы это знаем?"},"body":{"ja":"農場跡、船、墓、港湾遺跡、貨幣、碑文を文字史料と組み合わせます。","ru":"Археологи сопоставляют фермы, корабли, могилы, порты, монеты и надписи с письменными источниками."}}],
  "sources":["natmus-viking-age","natmus-viking-people"],
  "relations":[{"type":"leads_to","target":"viking-02-everyday-life"},{"type":"leads_to","target":"viking-03-why-sea"}],"next":"viking-02-everyday-life"
}