{
  "id":"viking-12-legacy","kind":"question_page","title":{"ja":"ヴァイキング時代は、何を残した？","ru":"Что осталось после эпохи викингов?"},
  "question":{"ja":"1066年で本当に全部終わったの？","ru":"Действительно ли всё закончилось в 1066 году?"},
  "answer":{"ja":"結論からいうと、1066年は便利な区切りですが、ヴァイキングの影響がそこで消えたわけではありません。地名、言語、交易圏、王権、移住、宗教、政治文化の中に長く残りました。","ru":"Коротко: 1066 год — удобная граница, но влияние эпохи викингов не исчезло в этот момент. Оно продолжилось в топонимах, языке, торговле, королевской власти, миграциях, религии и политической культуре."},
  "story":{"ja":["歴史の時代名には、分かりやすい始まりと終わりが付けられます。でも実際の社会は、年号を境に突然別物にはなりません。","イングランドでは古ノルド語由来の地名や語彙が残り、北大西洋では北欧系の定住社会が続きました。デンマークやノルウェーではキリスト教王権が強まり、以前のネットワークを別の形で引き継ぎます。","だから『ヴァイキング時代が終わった』というより、海を使った移動と競争が生んだ社会が、中世ヨーロッパの新しい政治秩序へ組み替えられたと見る方が面白いです。"],"ru":["Исторические эпохи получают удобные даты начала и конца, но реальные общества не меняются мгновенно по календарю.","В Англии сохранились древнескандинавские элементы в топонимах и языке, в Северной Атлантике продолжали существовать скандинавские поселения, а в Дании и Норвегии укреплялись христианские монархии.","Поэтому полезнее говорить не просто о «конце эпохи», а о превращении сетей мобильности, войны и торговли в новый политический порядок Средневековья."]},
  "evidence":{"ja":["地名・語彙・貨幣・法・考古資料に長期的な影響が残ります。","1066年以後も北欧とブリテン、北大西洋の関係は続きました。"],"ru":["Долговременное влияние видно в топонимах, языке, монетах, праве и археологии.","Связи между Скандинавией, Британией и Северной Атлантикой продолжались и после 1066 года."]},
  "so_what":{"ja":"時代区分は便利な地図であって現実そのものではありません。『いつ終わった？』より『何が形を変えて残った？』と問うと、歴史の連続性が見えます。","ru":"Периодизация — это полезная карта, а не сама реальность. Вопрос «что изменилось и что продолжилось?» часто важнее точной даты конца эпохи."},
  "period":{"start":1000,"end":1150,"label":{"ja":"11〜12世紀","ru":"XI–XII века"}},"places":["scandinavia","england","north-atlantic"],"domains":["politics","culture","language","economy"],"entities":["danelaw","cnut"],"topics":["viking-age","medieval-europe"],"concepts":["historical-continuity","periodization","cultural-legacy"],
  "timeline":{"layer":"culture","importance":4},"image":{"query":"Viking legacy York Jelling medieval Scandinavia","preferred_sources":["Wikimedia Commons","British Museum"]},
  "layers":[{"type":"detail","title":{"ja":"なぜ1066年がよく使われる？","ru":"Почему часто используют 1066 год?"},"body":{"ja":"イングランドではスタンフォード・ブリッジの戦いとノルマン征服が重なるため象徴的な区切りです。ただし地域によって『ヴァイキング時代』の終わり方は異なります。","ru":"В Англии 1066 год символичен из-за Стамфорд-Бриджа и Нормандского завоевания, но в разных регионах конец эпохи выглядел по-разному."}},{"type":"connect","title":{"ja":"次はどこへつながる？","ru":"Куда идти дальше?"},"body":{"ja":"中世イングランド、ノルマン征服、北欧王国、十字軍、ルーシ、北大西洋世界へ自然につながります。","ru":"Дальше тема естественно ведёт к средневековой Англии, Нормандскому завоеванию, скандинавским королевствам, Руси, крестовым походам и Северной Атлантике."}}],
  "sources":["englishheritage-vikings-england","ashmolean-danelaw","natmus-viking-age"],"relations":[{"type":"part_of","target":"medieval-europe"},{"type":"leads_to","target":"norman-conquest"},{"type":"compare_with","target":"crusades"}],"next":null
}