{
  "id":"viking-05-raids-and-trade","kind":"question_page","title":{"ja":"略奪と交易は、別の世界だった？","ru":"Набеги и торговля были двумя разными мирами?"},
  "question":{"ja":"同じ人が商人にも略奪者にもなったの？","ru":"Мог один и тот же человек быть и торговцем, и грабителем?"},
  "answer":{"ja":"結論からいうと、略奪と交易は完全に別々ではありません。同じ航路、港、船、人間関係を使いながら、状況に応じて交換・徴収・略奪・傭兵活動が切り替わることがありました。","ru":"Коротко: торговля и набеги не были полностью разделены. Те же маршруты, порты, корабли и связи могли использоваться для обмена, вымогательства, грабежа или службы наёмниками."},
  "story":{"ja":["学校では『ヴァイキングが修道院を襲った』場面が目立ちます。でも、その船が通った海には同時に商人もいました。","銀、毛皮、鉄、琥珀、奴隷、ガラス、工芸品などが長距離を移動しました。価値の高い品がどこに集まるかを知ることは、交易にも略奪にも役立ちます。","だから海上ネットワークを理解する時は、平和な商売と暴力を別々に切り離すより、同じ移動圏の中で両方が起きていたと見る方が実態に近いです。"],"ru":["В учебниках особенно заметны нападения на монастыри. Но по тем же морям одновременно ходили и торговцы.","Серебро, меха, железо, янтарь, рабы, стекло и ремесленные изделия перемещались на большие расстояния. Знание того, где сосредоточены ценности, помогало и торговле, и грабежу.","Поэтому мир обмена и мир насилия полезнее рассматривать как части одной системы мобильности."]},
  "evidence":{"ja":["港湾遺跡と貨幣出土は広域交易を示します。","修道院年代記などは襲撃を記録しますが、被害側の史料であることも意識して読む必要があります。"],"ru":["Портовые находки и монеты показывают дальнюю торговлю.","Монастырские хроники фиксируют нападения, но важно помнить, что это тексты пострадавшей стороны."]},
  "so_what":{"ja":"『商人か戦士か』の二択をやめると、ヴァイキング時代の移動が経済と暴力の両方を含んでいたことが見えてきます。","ru":"Отказ от простого выбора «торговец или воин» помогает увидеть, что мобильность эпохи викингов соединяла экономику и насилие."},
  "period":{"start":793,"end":1000,"label":{"ja":"9〜10世紀","ru":"IX–X века"}},"places":["north-sea","baltic","britain"],"domains":["economy","military","politics"],"entities":["vikings"],"topics":["viking-age","trade-networks"],"concepts":["trade-raiding-continuum","mobility-network","source-bias"],
  "timeline":{"layer":"economy","importance":5},"image":{"query":"Viking Age silver hoard trade raid","preferred_sources":["Wikimedia Commons","National Museum of Denmark"]},
  "layers":[{"type":"connect","title":{"ja":"暴力と市場はなぜ同じ航路に集まる？","ru":"Почему насилие и торговля использовали одни маршруты?"},"body":{"ja":"富が集まる港や宗教施設、政治拠点を知ることは商売にも略奪にも有利でした。情報ネットワーク自体が価値を持ちます。","ru":"Знание портов, монастырей и политических центров, где концентрировались богатства, было полезно и для торговли, и для грабежа."}},{"type":"debate","title":{"ja":"『略奪者』像は史料が作った？","ru":"Образ грабителя создан источниками?"},"body":{"ja":"被害を受けた修道院側の記録は暴力を詳しく残しました。一方、日常的な交易は劇的な事件ほど年代記に残りません。史料の残り方が後世のイメージを偏らせる可能性があります。","ru":"Хроники пострадавших монастырей подробно описывали насилие, тогда как обычная торговля реже становилась событием для записи. Это влияет на позднейший образ эпохи."}}],
  "sources":["natmus-viking-age"],"relations":[{"type":"reaction_to","target":"viking-03-why-sea"},{"type":"leads_to","target":"viking-06-eastward"}],"next":"viking-06-eastward"
}