{
  "id":"viking-07-north-atlantic","kind":"question_page","title":{"ja":"北欧の人々は、本当に北米まで行った？","ru":"Правда ли скандинавы добрались до Северной Америки?"},
  "question":{"ja":"アイスランド、グリーンランド、その先へどう進んだの？","ru":"Как они добрались до Исландии, Гренландии и ещё дальше?"},
  "answer":{"ja":"結論からいうと、北大西洋を段階的に西へ進み、アイスランドとグリーンランドに定住し、1000年前後には北米にも到達していました。これは考古学的に確認されています。","ru":"Коротко: скандинавы постепенно продвигались на запад через Северную Атлантику, поселились в Исландии и Гренландии и около 1000 года достигли Северной Америки. Это подтверждено археологически."},
  "story":{"ja":["西への進出は、一度に北米へ向かった大航海ではありません。まず北大西洋の島々へ移住が広がり、アイスランド、次いでグリーンランドへ定住が進みました。","そのさらに西で、現在のカナダ・ニューファンドランド島にあるランス・オ・メドーから北欧系の建物跡や鉄加工の痕跡が見つかっています。","重要なのは『コロンブスより先に行った』という競争だけではありません。限られた人口と資源で、海を越えて新しい環境に定住しようとした社会の適応力と、その限界を見ることができます。"],"ru":["Продвижение на запад не было одним прыжком к Америке. Поселения постепенно распространялись по островам Северной Атлантики — сначала в Исландию, затем в Гренландию.","Ещё дальше на запад, в Л’Анс-о-Медоуз на Ньюфаундленде, археологи нашли скандинавские постройки и следы обработки железа.","Значение этой истории не только в том, что плавание состоялось раньше Колумба. Она показывает способность небольших обществ адаптироваться к новым условиям и одновременно пределы такой экспансии."]},
  "evidence":{"ja":["ランス・オ・メドーの考古遺跡は北欧系の滞在を直接示します。","アイスランド・グリーンランドの定住は考古資料と後世の文献の両方から研究されます。"],"ru":["Археологический комплекс Л’Анс-о-Медоуз прямо подтверждает скандинавское присутствие.","Поселения в Исландии и Гренландии изучаются по археологии и более поздним письменным традициям."]},
  "so_what":{"ja":"海上移動の歴史を『征服』だけでなく、移住・環境適応・人口規模という視点から見る入口になります。","ru":"Эта история позволяет смотреть на морскую экспансию не только как на завоевание, но и как на миграцию, адаптацию и демографический эксперимент."},
  "period":{"start":850,"end":1050,"label":{"ja":"9〜11世紀","ru":"IX–XI века"}},"places":["iceland","greenland","north-america"],"domains":["environment","technology","daily-life","migration"],"entities":["vikings"],"topics":["viking-age","north-atlantic"],"concepts":["stepwise-migration","environmental-adaptation","north-atlantic-network"],
  "timeline":{"layer":"people","importance":4},"image":{"query":"L'Anse aux Meadows Viking settlement reconstruction","preferred_sources":["Wikimedia Commons","Parks Canada"]},
  "layers":[{"type":"connect","title":{"ja":"大航海時代と何が違う？","ru":"Чем это отличалось от Великих географических открытий?"},"body":{"ja":"国家が大規模に支援した15〜16世紀の大西洋航海と違い、北大西洋の移住は人口規模も政治的背景も異なります。『海を越えた』という共通点だけで同じ現象と考えないことが大切です。","ru":"В отличие от океанских экспедиций XV–XVI веков, североатлантическая миграция имела другой масштаб населения и политической поддержки."}},{"type":"debate","title":{"ja":"サガはどこまで史実？","ru":"Насколько саги историчны?"},"body":{"ja":"サガは重要な手がかりですが、出来事からかなり後に書かれています。考古学的証拠と一致する部分と、文学的構成を分けて読む必要があります。","ru":"Саги важны, но записаны намного позже событий. Их необходимо сопоставлять с археологией и учитывать литературную форму."}}],
  "sources":["natmus-viking-age"],"relations":[{"type":"compare_with","target":"age-of-exploration"},{"type":"leads_to","target":"viking-08-religion"}],"next":"viking-08-religion"
}